{
  "qpr_version": "0.2.0",
  "record_id": "00000000-0000-0000-0000-000000000004",
  "created_at": "2026-01-01T12:00:00Z",
  "benchmark": {
    "id": "throughput",
    "display_name": "sequential batch throughput (fixture)",
    "suite_version": "0.1.0",
    "parameters": {
      "batches": 4,
      "batch_size": 3,
      "width": 2,
      "depth": 2
    }
  },
  "provider": {
    "name": "local",
    "adapter": "static_test"
  },
  "device": {
    "name": "static_device",
    "num_qubits": 4,
    "simulator": true
  },
  "execution": {
    "seed": 7,
    "shots": 64,
    "live": false,
    "transpilation": {
      "sdk": "fixed",
      "sdk_version": "0.0.0",
      "settings": {}
    },
    "submitted_at": "2026-01-01T12:00:00Z",
    "completed_at": "2026-01-01T12:00:00Z"
  },
  "circuits": [
    {
      "index": 0,
      "name": "t0",
      "qasm3": "OPENQASM 3.0;\ninclude \"stdgates.inc\";\nqubit[2] q;\nbit[2] c;\nc = measure q;\n",
      "qasm3_sha256": "c45bcc2da7e01f5b76772d320dc6c33b807a2417e94949d544318b04cbbfc2a8"
    }
  ],
  "results": {
    "raw": [
      {
        "circuit_index": 0,
        "shots": 64,
        "counts": {
          "00": 64
        }
      }
    ],
    "metrics": [
      {
        "name": "job_round_trip_seconds",
        "value": 0.0421,
        "unit": "seconds",
        "statistics": {
          "sample_size": 4,
          "confidence_level": 0.95,
          "ci_lower": 0.03789,
          "ci_upper": 0.04631,
          "estimator": "median_over_batches_bootstrap"
        },
        "quality": {
          "reliable": false,
          "issues": [
            "timing.simulator_not_comparable_to_hardware"
          ]
        }
      },
      {
        "name": "sustained_shots_per_second",
        "value": 4561.0,
        "unit": "shots/s",
        "statistics": {
          "sample_size": 4,
          "confidence_level": 0.95,
          "ci_lower": 4104.9,
          "ci_upper": 5017.1,
          "estimator": "median_over_batches_bootstrap"
        },
        "quality": {
          "reliable": false,
          "issues": [
            "timing.simulator_not_comparable_to_hardware"
          ]
        }
      },
      {
        "name": "sequential_layers_per_second",
        "value": 356.0,
        "unit": "layers/s",
        "statistics": {
          "sample_size": 4,
          "confidence_level": 0.95,
          "ci_lower": 320.4,
          "ci_upper": 391.6,
          "estimator": "median_over_batches_bootstrap"
        },
        "quality": {
          "reliable": false,
          "issues": [
            "timing.simulator_not_comparable_to_hardware"
          ]
        }
      }
    ],
    "analysis": {
      "batches": [
        {
          "batch": 0,
          "round_trip_seconds": 0.0418
        },
        {
          "batch": 1,
          "round_trip_seconds": 0.0421
        },
        {
          "batch": 2,
          "round_trip_seconds": 0.0436
        },
        {
          "batch": 3,
          "round_trip_seconds": 0.0419
        }
      ],
      "round_trip_seconds": {
        "median": 0.042,
        "iqr": [
          0.0419,
          0.0425
        ],
        "min": 0.0418,
        "max": 0.0436
      },
      "timing_source": "client_wall_clock_per_batch"
    }
  },
  "provenance": {
    "veriqant_bench_version": "0.1.0",
    "python_version": "3.12.0",
    "platform": "golden-fixture",
    "sdk_versions": {
      "veriqant-bench": "0.1.0"
    }
  },
  "integrity": {
    "content_sha256": "872158b29fa453f9b006123fda5a31a029050d153d9d6888c9c47f8c6625f213"
  }
}
