{
  "qpr_version": "0.3.0",
  "record_id": "7f1c1b2a-9d4e-4f6a-8b3c-2e5d6a7b8c9d",
  "created_at": "2026-06-09T12:00:00Z",
  "benchmark": {
    "id": "rb_1q",
    "display_name": "1-qubit randomized benchmarking",
    "suite_version": "0.1.0",
    "parameters": {
      "sequence_lengths": [
        1,
        2,
        4,
        8
      ],
      "samples_per_length": 5
    }
  },
  "provider": {
    "name": "local",
    "adapter": "aer_simulator"
  },
  "device": {
    "name": "aer_simulator",
    "num_qubits": 1,
    "simulator": true
  },
  "execution": {
    "seed": 42,
    "shots": 100,
    "live": false,
    "transpilation": {
      "sdk": "qiskit",
      "sdk_version": "1.4.2",
      "optimization_level": 1,
      "settings": {
        "routing_method": "sabre"
      }
    },
    "submitted_at": "2026-06-09T12:00:00Z",
    "completed_at": "2026-06-09T12:00:00Z"
  },
  "circuits": [
    {
      "index": 0,
      "name": "rb_q0_len1_sample0",
      "qasm3": "OPENQASM 3.0;\ninclude \"stdgates.inc\";\nqubit[1] q;\nbit[1] c;\nh q[0];\nc[0] = measure q[0];\n",
      "qasm3_sha256": "b7fb46417f9a60c0427528c703f725f4d1bf4540fc6f69ea08138144b0665852",
      "metadata": {
        "sequence_length": 1
      }
    }
  ],
  "results": {
    "raw": [
      {
        "circuit_index": 0,
        "shots": 100,
        "counts": {
          "0": 52,
          "1": 48
        }
      }
    ],
    "metrics": [
      {
        "name": "survival_probability",
        "value": 0.52,
        "unit": "probability",
        "qubits": [
          0
        ],
        "statistics": {
          "sample_size": 100,
          "confidence_level": 0.95,
          "ci_lower": 0.42,
          "ci_upper": 0.62,
          "std_error": 0.05,
          "estimator": "binomial_wilson"
        }
      }
    ]
  },
  "provenance": {
    "veriqant_bench_version": "0.1.0",
    "python_version": "3.12.13",
    "platform": "test",
    "sdk_versions": {
      "qiskit": "1.4.2"
    }
  },
  "integrity": {
    "content_sha256": "d9689a485bd7e69f6f9a1e4d04d2af5276336d49ac947cbc7d0c430aeab898d5"
  }
}
